{
  "awaiting_manual_merge": 0,
  "bets_discovered": 474,
  "blocked": 1,
  "by_sport": {
    "CBB": {
      "auto_merge": null,
      "classification": "UNSUPPORTED",
      "delivered": null,
      "destination_repo": null,
      "eligible": null,
      "failed": 0,
      "last_error_type": null,
      "ledger_branch": null,
      "on_ledger": null,
      "proposed_not_merged": null,
      "routable": false,
      "settlement": null,
      "status": "NOT_ROUTABLE"
    },
    "CFB": {
      "auto_merge": true,
      "classification": "SUPPORTED",
      "delivered": 168,
      "destination_repo": "chmoses98/cfb-edge-finder",
      "eligible": 168,
      "failed": 0,
      "last_error_type": null,
      "ledger_branch": "accounting-data",
      "on_ledger": 168,
      "proposed_not_merged": 0,
      "routable": true,
      "settlement": {
        "on_ledger": 159,
        "proposed_not_merged": 0,
        "refused": 0,
        "rows": 159,
        "status": "SETTLED",
        "unaccounted": 0,
        "waiting_for_parent_wager": 0
      },
      "status": "DELIVERED"
    },
    "MLB": {
      "auto_merge": true,
      "classification": "SUPPORTED",
      "delivered": null,
      "destination_repo": "chmoses98/edge-finder-api",
      "eligible": 119,
      "failed": 119,
      "last_error_type": "the",
      "ledger_branch": "main",
      "on_ledger": 118,
      "proposed_not_merged": 1,
      "routable": true,
      "settlement": null,
      "status": "FAILED"
    },
    "NBA": {
      "auto_merge": false,
      "classification": "SUPPORTED",
      "delivered": 0,
      "destination_repo": "chmoses98/nba-edge-finder",
      "eligible": null,
      "failed": 0,
      "last_error_type": null,
      "ledger_branch": "accounting-data",
      "on_ledger": null,
      "proposed_not_merged": null,
      "routable": true,
      "settlement": null,
      "status": "NO_OP"
    },
    "NFL": {
      "auto_merge": true,
      "classification": "SUPPORTED",
      "delivered": 148,
      "destination_repo": "chmoses98/nfl-edge-finder",
      "eligible": 148,
      "failed": 0,
      "last_error_type": null,
      "ledger_branch": "handicap-data",
      "on_ledger": 148,
      "proposed_not_merged": 0,
      "routable": true,
      "settlement": {
        "on_ledger": 148,
        "proposed_not_merged": 0,
        "refused": 0,
        "rows": 148,
        "status": "SETTLED",
        "unaccounted": 0,
        "waiting_for_parent_wager": 0
      },
      "status": "DELIVERED"
    },
    "NHL": {
      "auto_merge": true,
      "classification": "SUPPORTED",
      "delivered": 30,
      "destination_repo": "chmoses98/NHL-edge-finder",
      "eligible": 30,
      "failed": 0,
      "last_error_type": null,
      "ledger_branch": "accounting-data",
      "on_ledger": 30,
      "proposed_not_merged": 0,
      "routable": true,
      "settlement": {
        "on_ledger": 30,
        "proposed_not_merged": 0,
        "refused": 0,
        "rows": 30,
        "status": "SETTLED",
        "unaccounted": 0,
        "waiting_for_parent_wager": 0
      },
      "status": "DELIVERED"
    },
    "SOCCER": {
      "auto_merge": true,
      "classification": "SUPPORTED",
      "delivered": 9,
      "destination_repo": "chmoses98/soccer-edge-finder",
      "eligible": 9,
      "failed": 0,
      "last_error_type": null,
      "ledger_branch": "accounting-data",
      "on_ledger": 9,
      "proposed_not_merged": 0,
      "routable": true,
      "settlement": {
        "on_ledger": 9,
        "proposed_not_merged": 0,
        "refused": 0,
        "rows": 9,
        "status": "SETTLED",
        "unaccounted": 0,
        "waiting_for_parent_wager": 0
      },
      "status": "DELIVERED"
    },
    "TENNIS": {
      "auto_merge": false,
      "classification": "SUPPORTED",
      "delivered": 0,
      "destination_repo": "chmoses98/Tennis-Edge-Finder",
      "eligible": null,
      "failed": 0,
      "last_error_type": null,
      "ledger_branch": "accounting-data",
      "on_ledger": null,
      "proposed_not_merged": null,
      "routable": true,
      "settlement": null,
      "status": "NO_OP"
    }
  },
  "commit_sha": "4b7aaa2a49c0cdf765ced649ab90ba5589953e9c",
  "deferred": 6,
  "delivered": 355,
  "errors": [
    "MLB: the auto-merge gate REFUSED this batch. The rows are delivered and remain on kalshi-router/MLB; they are NOT on main. See the named condition above.",
    "router: Process completed with exit code 1."
  ],
  "failed": 119,
  "generated_at": "2026-10-17T16:52:09Z",
  "kind": "router_health",
  "last_delivery_run": {
    "concluded_at": "2026-10-17T16:38:53Z",
    "conclusion": "failure",
    "health_state": "blocked",
    "run_id": "39048574052",
    "started_at": "2026-10-17T16:14:58Z",
    "url": "https://github.com/chmoses98/kalshi-bet-router/actions/runs/39048574052"
  },
  "last_poll_at": "2026-10-17T16:14:58Z",
  "last_settlement_run": {
    "concluded_at": "2026-10-17T16:08:52Z",
    "conclusion": "success",
    "health_state": null,
    "run_id": "39047208778",
    "started_at": "2026-10-17T15:56:01Z",
    "url": "https://github.com/chmoses98/kalshi-bet-router/actions/runs/39047208778"
  },
  "overall_status": "DEGRADED",
  "poll_age_seconds": 2231.7,
  "router_health_state": "blocked",
  "run_id": "run_20261017165209000000",
  "schema_version": "edge_finder.app.v1",
  "sport": "ALL",
  "thresholds": {
    "router": {
      "fresh_after_seconds": 1800,
      "stale_after_seconds": 14400
    },
    "settlement": {
      "fresh_after_seconds": 86400,
      "stale_after_seconds": 259200
    }
  },
  "waiting_for_parent_wager": 0,
  "warnings": [
    "router health is BLOCKED: a wager exists that no destination can record; see the refusal counts",
    "NBA: observation period (auto_merge off); deliveries open a pull request a person merges",
    "TENNIS: observation period (auto_merge off); deliveries open a pull request a person merges"
  ]
}
